{
  "id": "szacho/augmix-data-augmentation-on-tpu",
  "id_no": 8915523,
  "title": "AugMix data augmentation on TPU",
  "code_file": "augmix-data-augmentation-on-tpu.ipynb",
  "language": "python",
  "kernel_type": "notebook",
  "is_private": false,
  "enable_gpu": true,
  "enable_internet": true,
  "keywords": [],
  "dataset_sources": [],
  "kernel_sources": [],
  "competition_sources": [
    "competitions/flower-classification-with-tpus"
  ]
}