{
  "id": "fx6300/clam-strip-ai-inference",
  "id_no": 30660721,
  "title": "\ud83d\udc1aCLAM STRIP AI [inference]\ud83d\udc1a",
  "code_file": "clam-strip-ai-inference.ipynb",
  "language": "python",
  "kernel_type": "notebook",
  "is_private": false,
  "enable_gpu": false,
  "enable_internet": false,
  "keywords": [],
  "dataset_sources": [
    "datasets/fx6300/clambaseline",
    "datasets/fx6300/my-rembg",
    "datasets/fx6300/opencv-contrib",
    "datasets/fx6300/resnet50-baselinepth",
    "datasets/fx6300/tiling030",
    "datasets/fx6300/u2net-onnx"
  ],
  "kernel_sources": [
    "code/analokamus/how-to-use-pyvips-offline"
  ],
  "competition_sources": [
    "competitions/mayo-clinic-strip-ai"
  ]
}