{
  "id": "sermakarevich/micro-visuals-wsi-mask-zoom",
  "id_no": 9175340,
  "title": "Micro visuals: WSI * mask * zoom",
  "code_file": "micro-visuals-wsi-mask-zoom.ipynb",
  "language": "python",
  "kernel_type": "notebook",
  "is_private": false,
  "enable_gpu": false,
  "enable_internet": true,
  "keywords": [],
  "dataset_sources": [],
  "kernel_sources": [],
  "competition_sources": [
    "competitions/prostate-cancer-grade-assessment"
  ]
}