{
  "id": "fx6300/clam-strip-ai-feature-extraction",
  "id_no": 30714063,
  "title": "\ud83d\udc1aCLAM STRIP AI [feature extraction]\ud83d\udc1a",
  "code_file": "clam-strip-ai-feature-extraction.ipynb",
  "language": "python",
  "kernel_type": "notebook",
  "is_private": false,
  "enable_gpu": false,
  "enable_internet": false,
  "keywords": [
    "gpu"
  ],
  "dataset_sources": [
    "datasets/fx6300/4096-tiles-v4"
  ],
  "kernel_sources": [],
  "competition_sources": [
    "competitions/mayo-clinic-strip-ai"
  ]
}