{
  "id": "dschettler8845/use-pyvips-offline-v-2-1-13",
  "id_no": 28815771,
  "title": "Use PyVips Offline (v. 2.1.13)",
  "code_file": "use-pyvips-offline-v-2-1-13.ipynb",
  "language": "python",
  "kernel_type": "notebook",
  "is_private": false,
  "enable_gpu": true,
  "enable_internet": false,
  "keywords": [],
  "dataset_sources": [
    "datasets/yukkyo/pyvips-local"
  ],
  "kernel_sources": [],
  "competition_sources": [
    "competitions/mayo-clinic-strip-ai"
  ]
}