{
  "id": "sakima/medical-whole-slide-processing-speed-up",
  "id_no": 29751960,
  "title": " Medical Whole Slide Processing: Speed Up!",
  "code_file": "medical-whole-slide-processing-speed-up.ipynb",
  "language": "python",
  "kernel_type": "notebook",
  "is_private": false,
  "enable_gpu": false,
  "enable_internet": true,
  "keywords": [],
  "dataset_sources": [],
  "kernel_sources": [],
  "competition_sources": [
    "competitions/mayo-clinic-strip-ai"
  ]
}