{
  "id": "leahscherschel/glomeruli-detection-related-works",
  "id_no": 12731722,
  "title": "Glomeruli Detection Related Works",
  "code_file": "glomeruli-detection-related-works.ipynb",
  "language": "python",
  "kernel_type": "notebook",
  "is_private": false,
  "enable_gpu": false,
  "enable_internet": true,
  "keywords": [],
  "dataset_sources": [],
  "kernel_sources": [],
  "competition_sources": [
    "competitions/hubmap-kidney-segmentation"
  ]
}