{
  "id": "tanushrikumar/wsi-monk-code",
  "id_no": 24359709,
  "title": "WSI - Monk code",
  "code_file": "wsi-monk-code.ipynb",
  "language": "python",
  "kernel_type": "notebook",
  "is_private": false,
  "enable_gpu": false,
  "enable_internet": false,
  "keywords": [],
  "dataset_sources": [
    ""
  ],
  "kernel_sources": [],
  "competition_sources": []
}