{
  "id": "sermakarevich/patchslicer-generator-and-plots-of-sorted-patches",
  "id_no": 9119256,
  "title": "PatchSlicer generator and plots of sorted patches ",
  "code_file": "patchslicer-generator-and-plots-of-sorted-patches.ipynb",
  "language": "python",
  "kernel_type": "notebook",
  "is_private": false,
  "enable_gpu": false,
  "enable_internet": true,
  "keywords": [
    "data visualization"
  ],
  "dataset_sources": [],
  "kernel_sources": [],
  "competition_sources": [
    "competitions/prostate-cancer-grade-assessment"
  ]
}