{
  "id": "habibmrad1983/prostate-cancer-in-depth-understanding-eda-model",
  "id_no": 15569815,
  "title": "Prostate Cancer: In Depth Understanding,EDA ,Model",
  "code_file": "prostate-cancer-in-depth-understanding-eda-model.ipynb",
  "language": "python",
  "kernel_type": "notebook",
  "is_private": false,
  "enable_gpu": false,
  "enable_internet": true,
  "keywords": [],
  "dataset_sources": [],
  "kernel_sources": [],
  "competition_sources": [
    "competitions/prostate-cancer-grade-assessment"
  ]
}