{
  "id": "vbookshelf/part-1-breast-cancer-analyzer-web-app",
  "id_no": 2270637,
  "title": "Part 1 : Breast Cancer Analyzer + Web App",
  "code_file": "part-1-breast-cancer-analyzer-web-app.ipynb",
  "language": "python",
  "kernel_type": "notebook",
  "is_private": false,
  "enable_gpu": true,
  "enable_internet": true,
  "keywords": [
    "cancer"
  ],
  "dataset_sources": [
    "datasets/paultimothymooney/breast-histopathology-images"
  ],
  "kernel_sources": [],
  "competition_sources": []
}