{
  "id": "kerneler/starter-mitosis-wsi-ccmct-training-set-48450e6f-5",
  "id_no": 7636525,
  "title": "Starter: Mitosis WSI CCMCT Training Set 48450e6f-5",
  "code_file": "starter-mitosis-wsi-ccmct-training-set-48450e6f-5.ipynb",
  "language": "python",
  "kernel_type": "notebook",
  "is_private": false,
  "enable_gpu": false,
  "enable_internet": false,
  "keywords": [],
  "dataset_sources": [
    "datasets/marcaubreville/mitosis-wsi-ccmct-training-set"
  ],
  "kernel_sources": [],
  "competition_sources": []
}