{
  "id": "fx6300/clam-strip-ai-train",
  "id_no": 30722906,
  "title": "\ud83d\udc1aCLAM STRIP AI [train]\ud83d\udc1a",
  "code_file": "clam-strip-ai-train.ipynb",
  "language": "python",
  "kernel_type": "notebook",
  "is_private": false,
  "enable_gpu": false,
  "enable_internet": false,
  "keywords": [],
  "dataset_sources": [
    ""
  ],
  "kernel_sources": [
    "code/analokamus/how-to-use-pyvips-offline"
  ],
  "competition_sources": [
    "competitions/mayo-clinic-strip-ai"
  ]
}