{
  "id": "jberros/panda-wsi-manipulation-openslide-overview",
  "id_no": 9181539,
  "title": "PANDA_WSI_Manipulation_Openslide_Overview",
  "code_file": "panda-wsi-manipulation-openslide-overview.ipynb",
  "language": "python",
  "kernel_type": "notebook",
  "is_private": false,
  "enable_gpu": false,
  "enable_internet": true,
  "keywords": [
    "data visualization"
  ],
  "dataset_sources": [],
  "kernel_sources": [],
  "competition_sources": [
    "competitions/prostate-cancer-grade-assessment"
  ]
}